{
    "schema_version": 1,
    "memory_id": "01936d5a-8c4e-7001-8000-000000000001",
    "tenant_id": "01936d5a-8c4e-7002-8000-000000000002",
    "lineage_id": "01936d5a-8c4e-7003-8000-000000000003",
    "branch_id": "01936d5a-8c4e-7004-8000-000000000004",
    "subject_id": "01936d5a-8c4e-7005-8000-000000000005",
    "subject_kind": "project",
    "origin_session_id": null,
    "revision": 1,
    "category": "project_decision",
    "ontological_status": "literal_technical_fact",
    "scope": "project",
    "visibility": "restricted",
    "status": "active",
    "statement": "Contract fixtures are validated with local reference resolution.",
    "reason_to_remember": "This synthetic record exercises the projection contract.",
    "interpretation_limits": [
        "Synthetic contract-test data only."
    ],
    "confidence": 1,
    "salience": 0.8,
    "durability": 0.9,
    "sensitivity": 1,
    "authority_class": "verified_project_source",
    "valid_from": "2026-08-03T18:00:00.000000Z",
    "valid_to": null,
    "observed_at": "2026-08-03T18:00:00.000000Z",
    "created_at": "2026-08-03T18:00:00.000000Z",
    "updated_at": "2026-08-03T18:00:00.000000Z",
    "normalized_fingerprint": "0123456789abcdef0123456789abcdef0123456789abcdef0123456789abcdef",
    "fingerprint_version": 1,
    "publication_approved_at": null,
    "publication_approved_by_actor_id": null,
    "content_protection": "plaintext",
    "content_key_id": null,
    "metadata": {
        "fixture": true
    }
}
